PT-06(02),Personal information banks: Exempt banks,Control,,Review all PIBs that were designated as exempt banks under section 18 of the Privacy Act [Assignment: organization-defined frequency] to ensure they remain appropriate and necessary in accordance with law.,"The Privacy Act includes provisions that allow federal departments and agencies to claim exemptions to TBS from certain requirements. A PIB qualifies for exemption when more than half of the information in each file contained in the bank qualifies for an exemption under section 21 or 22 of the Privacy Act. The described files consist predominantly of personal information that relates to international affairs, defence, and law enforcement and investigation. Exempt PIBs still require registration with TBS.

CDS Discussion: Exempt banks are unlikely to applicable.",,,,,,,,,,,
PT-07,Particularly sensitive personal information,,,Apply [Assignment: organization-defined handling conditions] PIA process and Security Categorization procedure for particularly sensitive personal information.,"Organizations should apply any conditions or protections that may be necessary for particularly sensitive personal information. These conditions may be required by laws, Orders in Council, directives, regulations, policies, standards, or guidelines. The requirements may also come from the results of privacy risk assessments that factor in contextual changes that may result in an organizational determination that a particular category of personal information is particularly sensitive or raises particular privacy risks. Organizations should consult with the appropriate privacy senior official or executive and legal counsel regarding any protections that may be necessary.","Privacy Act

TBS Directive on Privacy Practices

TBS Directive on Social Insurance Number

OPC Interpretation Bulletin: Sensitive Information

Canadian Charter of Rights and Freedoms","IR-09, PT-02, PT-03, PT-05, PT-06, RA-03",,,,,,,,X,P1
PT-07(01),Particularly sensitive personal information: Social insurance numbers,,,"When a program or activity collects, uses, or discloses social insurance numbers (SINs):
a. ensure there is express authority for the collection and use of the SIN
b. provide notice, at the point of collection, regarding the authority to collect as well as the anticipated use or disclosures of the SIN
c. ensure the collection and use of SIN is included in the associated PIB, if appropriate","GC discussion: GC policy establishes specific requirements for organizations’ handling of some categories of particularly sensitive personal information such as SINs. The SIN is a confidential number that should not be used as identification or provided for non-governmental purposes. Organizations should take steps to eliminate unnecessary uses of SINs and other sensitive information and should observe any particular requirements that apply.The collection and use of the SIN by government institutions should only be for the authorized and lawful purposes outlined in Appendix A of the TBS Directive on Social Insurance Number. The directive provides direction to government institutions on how the SIN can be collected, used, and disclosed. It also outlines the methods to establish policy authority for a new collection or new consistent use of the SIN.",,IA-04,,,,,,,,X,P1
PT-07(02),Particularly sensitive personal information: Canadian Charter of Rights and Freedoms,,,Restrict the handling of information describing how any individual exercises rights guaranteed by the Canadian Charter of Rights and Freedoms unless there is lawful authority or if it is within the scope of an authorized law-enforcement activity.,GC discussion: Organizations should exercise caution when considering the collection of data elements protected under the Canadian Charter of Rights and Freedoms to ensure there is lawful authority for the handling of that personal information. Organizations should consult with the appropriate privacy senior official or executive and legal counsel.,,,,,,,,,,X,P1
PT-08,Data Matching Requirements,,,"When a program activity seeks to collect, use, or disclose personal information for the purpose of conducting a data matching activity:
A. ensure the authority exists to collect, use, or disclose the personal information for the purpose of data matching
B. develop and enter into an information sharing agreement or information sharing arrangement for the purpose of data matching
C. verify that the [Selection (1): notice to the individual; consent obtained from the individual] notice to the individual identifies that the information will be used for data matching activities
D. verify that the associated PIB identifies that the information will be used for data matching activities","GC discussion: Data matching is defined as an activity involving the comparison of personal information from different sources, including sources within the same government institution, for administrative or non-administrative purposes. The data-matching activity that is established can be systematic or recurring. The data-matching activity can also be conducted on a periodic basis when deemed necessary. Data matching includes the disclosure or sharing of personal information with another organization for data-matching purposes.",TBS Policy on Privacy Protection,"AC-21, PT-02, PT-03, PT-05, PT-06, PT-07, SI-18",,,,,,,,X,P2