Family,Control ID,Enhancement,Name,Class,Definition,Supplemental Guidance,References,IT Security Function,IT Operations Group,IT Projects,Physical Security Group,Personnel Security Group,Learning Center,General Tailoring and Implementation Guidance Notes,SuggestedPriority,Suggested for this Profile,Suggested Placeholder Values,Profile-Specific Notes
AC,2,-1,ACCOUNT MANAGEMENT,Technical,"ACCOUNT MANAGEMENT | AUTOMATED SYSTEM ACCOUNT MANAGEMENT
 The organization employs automated mechanisms to support the management of information system accounts.","The use of automated mechanisms can include, for example: using email or text messaging to automatically notify account managers when users are terminated or transferred; using the information system to monitor account usage; and using telephonic notification to report atypical system account usage.",,,R,S,,,,"This security control/enhancement can be met using readily available Commercial-Off-The-Shelf (COTS) components. Consequently, inclusion of this security control/enhancement is strongly encouraged in most cases.",P2,,,
AC,2,-5,ACCOUNT MANAGEMENT,Technical,"ACCOUNT MANAGEMENT | INACTIVITY LOGOUT
 The organization requires that users log out when [Assignment: organization-defined time-period of expected inactivity or description of when to log out]. Related controls: SC-23",,,S,R,S,,,S,Users should be required to log out at the end of the business day in order to enable the organization to apply the appropriate patches to the operating system. Organizations are typically unable to patch the operating system when a user has an active session.,P2,,(5a) time period [end of business day],
AC,2,-7,ACCOUNT MANAGEMENT,Technical,"ACCOUNT MANAGEMENT | ROLE-BASED SCHEMES
 (a) The organization establishes and administers privileged user accounts in accordance with a role-based access scheme that organizes allowed information system access and privileges into roles;
 (b) The organization monitors privileged role assignments; and
 (c) The organization takes [Assignment: organization-defined actions] when privileged role assignments are no longer appropriate.","Privileged roles are organization-defined roles assigned to individuals that allow those individuals to perform certain security-relevant functions that ordinary users are not authorized to perform. These privileged roles include, for example, key management, account management, network and system administration, database administration, and web administration.",,S,R,,,,,"This security control/enhancement can be met using readily available Commercial-Off-The-Shelf (COTS) components, and is considered to be best practice. Consequently, inclusion of this security control/enhancement is strongly encouraged in most cases.
 The minimization of administrative privileges is an account management best-practice.",P2,,,
AC,2,-9,ACCOUNT MANAGEMENT,Technical,"ACCOUNT MANAGEMENT | RESTRICTIONS ON USE OF SHARED GROUPS / ACCOUNTS
 The organization only permits the use of shared/group accounts that meet [Assignment: organization-defined conditions for establishing shared/group accounts].",,,,R,,,,,,None defined,,,
AC,2,-10,ACCOUNT MANAGEMENT,Technical,"ACCOUNT MANAGEMENT | SHARED / GROUP ACCOUNT CREDENTIAL TERMINATION
 The information system terminates shared/group account credentials when members leave the group.",,,,R,,,,,,None defined,,,
AC,5,,SEPARATION OF DUTIES,Technical,"(A) The organization:
 (a) Separates [Assignment: organization-defined duties of individuals];
 (b) Documents separation of duties of individuals; and 
 (c) Defines information system access authorizations to support separation of duties.","Separation of duties addresses the potential for abuse of authorized privileges and helps to reduce the risk of malevolent activity without collusion. Separation of duties includes, for example: (i) dividing mission functions and information system support functions among different individuals and/or roles; (ii) conducting information system support functions with different individuals (e.g., system management, programming, configuration management, quality assurance and testing, and network security); and (iii) ensuring security personnel administering access control functions do not also administer audit functions. Related controls: AC-3, AC-6, PE-3, PE-4, PS-2",,S,R,S,,,,"This security control/enhancement is considered to be best practice. Consequently, inclusion in a departmental profile is strongly encouraged in most cases.",P1,,,
AC,6,-1,LEAST PRIVILEGE,Technical,"LEAST PRIVILEGE | AUTHORIZE ACCESS TO SECURITY FUNCTIONS
 The organization explicitly authorizes access to [Assignment: organization-defined security functions (deployed in hardware, software, and firmware) and security-relevant information].","Security functions include, for example, establishing system accounts, configuring access authorizations (i.e., permissions, privileges), setting events to be audited, and setting intrusion detection parameters. Security-relevant information includes, for example, filtering rules for routers/firewalls, cryptographic key management information, configuration parameters for security services, and access control lists. Explicitly authorized personnel include, for example, security administrators, system and network administrators, system security officers, system maintenance personnel, system programmers, and other privileged users. Related controls: AC-17, AC-18, AC-19.",,R,,,,,,"This security control/enhancement is considered to be best practice. Consequently, inclusion in a departmental profile is strongly encouraged in most cases.",P2,,,
AC,6,-2,LEAST PRIVILEGE,Technical,"LEAST PRIVILEGE | NON-PRIVILEGED ACCESS FOR NON-SECURITY FUNCTIONS
 The organization requires that users of information system accounts, or roles, with access to [Assignment: organization-defined security functions or security-relevant information], use non-privileged accounts or roles, when accessing non-security functions.",This control enhancement limits an information system’s exposure to threats when users are operating from within privileged accounts or roles. The inclusion of roles addresses situations where organizations implement access control policies such as RBAC and where a change of role provides the same degree of assurance in the change of access authorizations for both the user and all processes acting on behalf of the user as would be provided by a change between a privileged and non-privileged account. Related control: PL-4.,,S,R,,,,,"This security control/enhancement is considered to be best practice. Consequently, inclusion in a departmental profile is strongly encouraged in most cases.",P2,,,
AC,6,-5,LEAST PRIVILEGE,Technical,"LEAST PRIVILEGE | PRIVILEGED ACCOUNTS
 The organization restricts privileged accounts on the information system to [Assignment: organization-defined personnel or roles].","Privileged accounts, including super user accounts, are typically described as system administrators for various types of commercial off-the-shelf operating systems. Restricting privileged accounts to specific personnel or roles prevents day-to-day users from having access to privileged information/functions. Organizations may differentiate in the application of this control enhancement between allowed privileges for local accounts and for domain accounts provided organizations retain the ability to control information system configurations for key security parameters and as otherwise necessary to sufficiently mitigate risk. Related control: CM-6.",,S,R,,,,,"This security control/enhancement is considered to be best practice. Consequently, inclusion in a departmental profile is strongly encouraged in most cases.",P1,,,
AC,6,-9,LEAST PRIVILEGE,Technical,"LEAST PRIVILEGE | AUDITING USE OF PRIVILEGED FUNCTIONS
 The information system audits the execution of privileged functions.","Misuse of privileged functions, either intentionally or unintentionally by authorized users, or by unauthorized external entities that have compromised information system accounts, is a serious and ongoing concern and can have significant adverse impacts on organizations. Auditing the use of privileged functions is one way to detect such misuse, and in doing so, help mitigate the risk from insider threats and the advanced persistent threat (APT). Related control: AU-2.",,R,S,,,,,,None defined,,,
AC,6,-10,LEAST PRIVILEGE,Technical,"LEAST PRIVILEGE | PROHIBIT NON-PRIVILEGED USERS FROM EXECUTING PRIVILEGED FUNCTIONS
 The information system prevents non-privileged users from executing privileged functions to include disabling, circumventing, or altering implemented security safeguards/countermeasures.","Privileged functions include, for example, establishing information system accounts, performing system integrity checks, or administering cryptographic key management activities. Non-privileged users are individuals that do not possess appropriate authorizations. Circumventing intrusion detection and prevention mechanisms or malicious code protection mechanisms are examples of privileged functions that require protection from non-privileged users.",,S,R,,,,,,None defined,,,
AC,17,-1,REMOTE ACCESS,Technical,"REMOTE ACCESS | AUTOMATED MONITORING / CONTROL
 The information system monitors and controls remote access methods.","Automated monitoring and control of remote access sessions allows organizations to detect cyber-attacks and also ensure ongoing compliance with remote access policies by auditing connection activities of remote users on a variety of information system components (e.g., servers, workstations, notebook computers, smart phones, and tablets). Related controls: AU-2, AU-12.",,,R,,,,,"This security control/enhancement is considered to be best practice. Consequently, inclusion in a departmental profile is strongly encouraged in most cases.",P2,,,
AC,17,-2,REMOTE ACCESS,Technical,"REMOTE ACCESS | PROTECTION OF CONFIDENTIALITY / INTEGRITY USING ENCRYPTION
 The information system implements cryptographic mechanisms to protect the confidentiality and integrity of remote access sessions. The cryptography must be compliant with the requirements of SC-13.",Guidance on Tthe encryption strength of mechanism can be obtained from CSE upon request.,,,R,S,,,,"This security control/enhancement is considered to be best practice. This security control/enhancement can be met using readily available Commercial-Off-The-Shelf (COTS) components. Consequently, inclusion in a departmental profile is strongly encouraged in most cases.",P2,,,
AC,17,-3,REMOTE ACCESS,Technical,"REMOTE ACCESS | MANAGED ACCESS CONTROL POINTS
 The information system routes all remote accesses through [Assignment: organization-defined number] managed network access control points.",Limiting the number of access control points for remote accesses reduces the attack surface for organizations. Organizations consider the Trusted Internet Connections (TIC) initiative requirements for external network connections. Related control: SC-7.,,,R,S,,,,"This security control/enhancement is considered to be best practice. Consequently, inclusion in a departmental profile is strongly encouraged in most cases.",P2,,,
AC,17,-4,REMOTE ACCESS,Technical,"REMOTE ACCESS | PRIVILEGED COMMANDS / ACCESS
 (a) The organization authorizes the execution of privileged commands and access to security-relevant information via remote access only for [Assignment: organization-defined needs]; and
 (b) The organization documents the rationale for such access in the security plan for the information system.",Related control: AC-6.,,S,R,S,,,,"This security control/enhancement is considered to be best practice. Consequently, inclusion in a departmental profile is strongly encouraged in most cases.",P2,,,
AC,17,-9,REMOTE ACCESS,Technical,"REMOTE ACCESS | DISCONNECT / DISABLE ACCESS
 The organization provides the capability to expeditiously disconnect or disable remote access to the information system within [Assignment: organization-defined time period].",This control enhancement requires organizations to have the capability to rapidly disconnect current users remotely accessing the information system and/or disable further remote access. The speed of disconnect or disablement varies based on the criticality of missions/business functions and the need to eliminate immediate or future remote access to organizational information systems.,,S,R,,,,,,None defined,,,
AC,17,-100,REMOTE ACCESS,Technical,Remote access to privileged accounts is performed on dedicated management consoles governed entirely by the system’s security policies and used exclusively for this purpose (e.g. Internet access not allowed).,,,,R,S,,,,"This security control/enhancement is considered to be best practice. Consequently, inclusion in a departmental profile is strongly encouraged in most cases.",P2,,,
AC,18,-4,WIRELESS ACCESS,Technical,"WIRELESS ACCESS | RESTRICT CONFIGURATIONS BY USERS
 The organization identifies and explicitly authorizes users allowed to independently configure wireless networking capabilities.","Organizational authorizations to allow selected users to configure wireless networking capability are enforced in part, by the access enforcement mechanisms employed within organizational information systems. Related controls: AC-3, SC-15.",,,R,S,,,,,P2,,,
AC,20,-1,USE OF EXTERNAL INFORMATION SYSTEMS,Technical,"USE OF EXTERNAL INFORMATION SYSTEMS | LIMITS ON AUTHORIZED USE
 The organization permits authorized individuals to use an external information system to access the information system or to process, store, or transmit organization-controlled information only when the organization:
 (a) Verifies the implementation of required security controls on the external system as specified in the organization’s information security policy and security plan; or
 (b) Retains approved information system connection or processing agreements with the organizational entity hosting the external information system.","This control enhancement recognizes that there are circumstances where individuals using external information systems (e.g., contractors, coalition partners) need to access organizational information systems. In those situations, organizations need confidence that the external information systems contain the necessary security safeguards (i.e., security controls), so as not to compromise, damage, or otherwise harm organizational information systems. Verification that the required security controls have been implemented can be achieved, for example, by third-party, independent assessments, attestations, or other means, depending on the confidence level required by organizations. Related control: CA-2.",,R,,,,,,,P2,,,
AC,20,-2,USE OF EXTERNAL INFORMATION SYSTEMS,Technical,"USE OF EXTERNAL INFORMATION SYSTEMS | PORTABLE STORAGE DEVICES
 The organization [Selection: restricts; prohibits] the use of organization-controlled mobile devices by authorized individuals on external information systems.","Limits on the use of organization-controlled mobile devices in external information systems include, for example, complete prohibition of the use of such devices or restrictions on how the devices may be used and under what conditions the devices may be used.",,R,,,,,S,,P2,,,
AT,2,-2,SECURITY AWARENESS,Operational,"SECURITY AWARENESS | INSIDER THREAT
 The organization includes security awareness training on recognizing and reporting potential indicators of insider threat.
 Supplemental Guidance: Potential indicators and possible precursors of insider threat can include behaviours such as inordinate, long-term job dissatisfaction, attempts to gain access to information not required for job performance, unexplained access to financial resources, bullying or sexual harassment of fellow employees, workplace violence, and other serious violations of organizational policies, procedures, directives, rules, or practices. Security awareness training includes how to communicate employee and management concerns regarding potential indicators of insider threat through appropriate organizational channels in accordance with established organizational policies and procedures. Related controls: PL-4, PS-3, PS-6.",,,R,,,,,,,P1,,,
AU,2,-3,AUDITABLE EVENTS,Technical,"AUDIT EVENTS | REVIEWS AND UPDATES
 The organization reviews and updates the audited events [Assignment: organization-defined frequency].","Over time, the events that organizations believe should be audited may change. Reviewing and updating the set of audited events periodically is necessary to ensure that the current set is still necessary and sufficient.",,R,S,,,,,,P2,,(3) frequency [at a frequency no longer than annually],
AU,6,-3,"AUDIT REVIEW, ANALYSIS, AND REPORTING",Technical,"AUDIT REVIEW, ANALYSIS, AND REPORTING | CORRELATE AUDIT REPOSITORIES
 The organization analyzes and correlates audit records across different repositories to gain organization-wide situational awareness.","Organization-wide situational awareness includes awareness across all three tiers of risk management (i.e., organizational, mission/business process, and information system) and supports cross-organization awareness. Related controls: AU-12, IR-4.",,R,,,,,,,P2,,,
AU,9,-4,PROTECTION OF AUDIT INFORMATION,Technical,"PROTECTION OF AUDIT INFORMATION | ACCESS BY SUBSET OF PRIVILEGED USERS
 The organization authorizes access to management of audit functionality to only [Assignment: organization-defined subset of privileged users].","Individuals with privileged access to an information system and who are also the subject of an audit by that system, may affect the reliability of audit information by inhibiting audit activities or modifying audit records. This control enhancement requires that privileged access be further defined between audit-related privileges and other privileges, thus limiting the users with audit-related privileges. Related control: AC-5.",,S,R,S,,,,,P2,,,
CA,2,-1,SECURITY ASSESSMENTS,Management,"SECURITY ASSESSMENTS | INDEPENDENT ASSESSORS
 The organization employs assessors or assessment teams with [Assignment: organization-defined level of independence] to conduct security control assessments.","Independent assessors or assessment teams are individuals or groups who conduct impartial assessments of organizational information systems. Impartiality implies that assessors are free from any perceived or actual conflicts of interest with regard to the development, operation, or management of the organizational information systems under assessment or to the determination of security control effectiveness. To achieve impartiality, assessors should not: (i) create a mutual or conflicting interest with the organizations where the assessments are being conducted; (ii) assess their own work; (iii) act as management or employees of the organizations they are serving; or (iv) place themselves in positions of advocacy for the organizations acquiring their services. Independent assessments can be obtained from elements within organizations or can be contracted to public or private sector entities outside of organizations. Authorizing officials determine the required level of independence based on the security categories of information systems and/or the ultimate risk to organizational operations, organizational assets, or individuals. Authorizing officials also determine if the level of assessor independence provides sufficient assurance that the results are sound and can be used to make credible, risk-based decisions. This includes determining whether contracted security assessment services have sufficient independence, for example, when information system owners are not directly involved in contracting processes or cannot unduly influence the impartiality of assessors conducting assessments. In special situations, for example, when organizations that own the information systems are small or organizational structures require that assessments are conducted by individuals that are in the developmental, operational, or management chain of system owners, independence in assessment processes can be achieved by ensuring that assessment results are carefully reviewed and analyzed by independent teams of experts to validate the completeness, accuracy, integrity, and reliability of the results. Organizations recognize that assessments performed for purposes other than direct support to authorization decisions are, when performed by assessors with sufficient independence, more likely to be useable for such decisions, thereby reducing the need to repeat assessments.",,R,,,,,,,P1,,,
CA,2,-2,SECURITY ASSESSMENTS,Management,"SECURITY ASSESSMENTS | SPECIALIZED ASSESSMENTS
 The organization includes as part of security control assessments, [Assignment: organization-defined frequency], [Selection: announced; unannounced], [Selection (one or more): in-depth monitoring; vulnerability scanning; malicious user testing; insider threat assessment; performance/load testing; [Assignment: organization-defined other forms of security assessment]].","Organizations can employ information system monitoring, insider threat assessments, malicious user testing, and other forms of testing (e.g., verification and validation) to improve readiness by exercising organizational capabilities and indicating current performance levels as a means of focusing actions to improve security. Organizations conduct assessment activities in accordance with applicable directives, policies, regulations, and standards. Authorizing officials approve the assessment methods in coordination with the organizational risk management strategy. Organizations can incorporate vulnerabilities uncovered during assessments into vulnerability remediation processes. Related controls: PE-3, SI-2.",,R,,,,,,,P3,,,
CA,2,-3,SECURITY ASSESSMENTS,Management,"SECURITY ASSESSMENTS | EXTERNAL ORGANIZATIONS
 The organization accepts the results of an assessment of [Assignment: organization-defined information system] performed by [Assignment: organization-defined external organization] when the assessment meets [Assignment: organization-defined requirements].","Organizations may often rely on assessments of specific information systems by other (external) organizations. Utilizing such existing assessments (i.e., reusing existing assessment evidence) can significantly decrease the time and resources required for organizational assessments by limiting the amount of independent assessment activities that organizations need to perform. The factors that organizations may consider in determining whether to accept assessment results from external organizations can vary. Determinations for accepting assessment results can be based on, for example, past assessment experiences one organization has had with another organization, the reputation that organizations have with regard to assessments, the level of detail of supporting assessment documentation provided, or mandates imposed upon organizations by GC legislation and TBS policies, directives, and standards.",,R,,,,,,,None defined,,,
CA,3,-3,INFORMATION SYSTEM CONNECTIONS,Management,"SYSTEM INTERCONNECTIONS | UNCLASSIFIED NON-NATIONAL SECURITY SYSTEM CONNECTIONS
 The organization prohibits the direct connection of an [Assignment: organization-defined unclassified, non-national security system] to an external network without the use of [Assignment; organization-defined boundary protection device].","Organizations typically do not have control over external networks (e.g., the Internet). Approved boundary protection devices (e.g., routers, firewalls) mediate communications (i.e., information flows) between unclassified non-national security systems and external networks. This control enhancement is required for organizations processing, storing, or transmitting Protected Information.",,R,,,,,,,P1,,,
CA,3,-5,INFORMATION SYSTEM CONNECTIONS,Management,"SYSTEM INTERCONNECTIONS | RESTRICTIONS ON EXTERNAL SYSTEM CONNECTIONS
 The organization employs [Selection: allow-all, deny-by-exception; deny-all, permit-by-exception] policy for allowing [Assignment: organization-defined information systems] to connect to external information systems.","Organizations can constrain information system connectivity to external domains (e.g., websites) by employing one of two policies with regard to such connectivity: (i) allow-all, deny by exception, also known as blacklisting (the weaker of the two policies); or (ii) deny-all, allow by exception, also known as whitelisting (the stronger of the two policies). For either policy, organizations determine what exceptions, if any, are acceptable. Related control: CM-7.",,R,,,,,,Tailor and select as required.,None defined,,,
CA,7,-1,CONTINUOUS MONITORING,Management,"CONTINUOUS MONITORING | INDEPENDENT ASSESSMENT
 The organization employs assessors or assessment teams with [Assignment: organization-defined level of independence] to monitor the security controls in the information system on an ongoing basis.","Organizations can maximize the value of assessments of security controls during the continuous monitoring process by requiring that such assessments be conducted by assessors or assessment teams with appropriate levels of independence based on continuous monitoring strategies. Assessor independence provides a degree of impartiality to the monitoring process. To achieve such impartiality, assessors should not: (i) create a mutual or conflicting interest with the organizations where the assessments are being conducted; (ii) assess their own work; (iii) act as management or employees of the organizations they are serving; or (iv) place themselves in advocacy positions for the organizations acquiring their services.",,R,,,,,,,P1,,,
