PE,3,,PHYSICAL ACCESS CONTROL,Operational,"(A) The organization enforces physical access authorizations at [Assignment: organization-defined entry/exit points to the facility where the information system resides] by:
 (a) Verifying individual access authorizations before granting access to the facility; and
 (b) Controlling ingress/egress to the facility using [Selection (one or more): [Assignment: organization-defined physical access control systems/devices]; guards];
 (B) The organization maintains physical access audit logs for [Assignment: organization-defined entry/exit points].
 (C) The organization provides [Assignment: organization-defined security safeguards] to control access to areas within the facility officially designated as publicly accessible.
 (D) The organization escorts visitors and monitors visitor activity [Assignment: organization-defined circumstances requiring visitor escorts and monitoring].
 (E) The organization secures keys, combinations, and other physical access devices.
 (F) The organization inventories [Assignment: organization-defined physical access devices] every [Assignment: organization-defined frequency].
 (G) The organization changes combinations and keys [Assignment: organization-defined frequency] and/or when keys are lost, combinations are compromised, or individuals are transferred or terminated.","Control of access to restricted-access areas and other organizational space is to be provided in a manner which does not contravene the life safety requirements of the 2010 National Building Code (NBC) [Reference 19], 2010 National Fire Code (NFC) [Reference 20] and related codes, standards and guidelines. Refer to RCMP G1-010, Security Connotations of the 1995 National Building Code [Reference 21] for more informationThis control applies to organizational employees and visitors. Individuals (e.g., employees, contractors, and others) with permanent physical access authorization credentials are not considered visitors. Organizations determine the types of facility guards needed including, for example, professional physical security staff or other personnel such as administrative staff or information system users. Physical access devices include, for example, keys, locks, combinations, and card readers. Safeguards for publicly accessible areas within organizational facilities include, for example, cameras, monitoring by guards, and isolating selected information systems and/or system components in secured areas. Physical access control systems comply with applicable GC legislation and TBS policies, directives, and standards. Organizations have flexibility in the types of audit logs employed. Audit logs can be procedural (e.g., a written log of individuals accessing the facility and when such access occurred), automated (e.g., capturing ID provided by a PIV card), or some combination thereof. Physical access points can include facility access points, interior access points to information systems and/or components requiring supplemental access controls, or both. Components of organizational information systems (e.g., workstations, terminals) may be located in areas designated as publicly accessible with organizations safeguarding access to such devices. Related controls: AU-2, AU-6, MP-2, MP-4, PE-2, PE-4, PE-5, PS-3, RA-3.","PWGSC Industrial Security Manual [Reference 2].
 TBS Operational Security Standard on Physical Security [Reference 6].
 2010 National Building Code (NBC) [Reference 19].
 2010 National Fire Code (NFC) [Reference 20].
 RCMP G1-010 Security Connotations of the 1995 National Building Code [Reference 21].
 CSE ITSD-03A Directive for the Control of COMSEC Material in the Government of Canada [Reference 36].
 RCMP G1-005 Preparation of Physical Security Briefs [Reference 45].
 RCMP G1-007 Security Sealing of Buildings Emergency/Master Keys or Cypher Lock Codes [Reference 47].
 RCMP G1-008 Guidelines for Guard Services [Reference 48].
 RCMP G1-016 Master Key Systems [Reference 49].
 RCMP G1-024 Control of Access [Reference 50].
 RCMP G1-025 Protection, Detection and Response [Reference 51].
 RCMP G1-026 Guide to the Application of Physical Security Zones [Reference 52].
 RCMP G1-029 Secure Rooms [Reference 23].
 RCMP G1-031 Physical Protection of Computer Servers [Reference 53].",,,,R,,,,P1,,"(F) Inventories of physical devices [annually]
 (G) Changes combinations and keys [only when keys are lost, combinations are compromised or individuals are transferred or terminated]","According the TBS Operational Standard on Physical Security and RCMP G1-026 Guide to the Application of Physical Security Zones, a physical Operations Zone is the minimum required where sensitive GC information is processed or stored. A TRA must be performed to ensure the appropriate level of physical security to protect Protected B information and information systems processing and storing PB data. This zone is an area where access is limited to personnel who work there and to properly-escorted visitors; it must be indicated by a recognizable perimeter and monitored periodically."
PE,3,-1,PHYSICAL ACCESS CONTROL,Operational,"PHYSICAL ACCESS CONTROL | INFORMATION SYSTEM ACCESS
 The organization enforces physical access authorizations to the information system in addition to the physical access controls for the facility at [Assignment: organization-defined physical spaces containing one or more components of the information system].","This control enhancement provides additional physical security for those areas within facilities where there is a concentration of information system components (e.g., server rooms, media storage areas, and data and communications centres). Related control: PS-2.",,,,,R,,,,P2,,,
PE,4,,ACCESS CONTROL FOR TRANSMISSION MEDIUM,Operational,(A) The organization controls physical access to [Assignment: organization-defined information system distribution and transmission lines] within organizational facilities using [Assignment: organization-defined security safeguards].,"Physical security safeguards applied to information system distribution and transmission lines help to prevent accidental damage, disruption, and physical tampering. In addition, physical safeguards may be necessary to help prevent eavesdropping or in transit modification of unencrypted transmissions. Security safeguards to control physical access to system distribution and transmission lines include, for example: (i) locked wiring closets; (ii) disconnected or locked spare jacks; and/or (iii) protection of cabling by conduit or cable trays. Related controls: MP-2, MP-4, PE-2, PE-3, PE-5, SC-7, SC-8","RCMP G1-005 Preparation of Physical Security Briefs [Reference 45].
 RCMP G1-026 Guide to the Application of Physical Security Zones [Reference 52].",,,,R,,,,P1,,,
PE,5,,ACCESS CONTROL FOR OUTPUT DEVICES,Operational,(A) The organization controls physical access to information system output devices to prevent unauthorized individuals from obtaining the output.,"Controlling physical access to output devices includes, for example, placing output devices in locked rooms or other secured areas and allowing access to authorized individuals only, and placing output devices in locations that can be monitored by organizational personnel. Monitors, printers, copiers, scanners, facsimile machines, and audio devices are examples of information system output devices. Related controls: PE-2, PE-3, PE-4, PE-18.",RCMP G1-026 Guide to the Application of Physical Security Zones [Reference 52].,,,,R,,,,P2,,,
PE,6,,MONITORING PHYSICAL ACCESS,Operational,"(A) The organization monitors physical access to the facility where the information system resides to detect and respond to physical security incidents.
 (B) The organization reviews physical access logs [Assignment: organization-defined frequency] and upon occurrence of [Assignment: organization-defined events or potential indications of events].
 (C) The organization coordinates results of reviews and investigations with the organizational incident response capability.","Organizational incident response capabilities include investigations of and responses to detected physical security incidents. Security incidents include, for example, apparent security violations or suspicious physical access activities. Suspicious physical access activities include, for example: (i) accesses outside of normal work hours; (ii) repeated accesses to areas not normally accessed; (iii) accesses for unusual lengths of time; and (iv) out-of-sequence accesses. Related controls: CA-7, IR-4, IR-8","RCMP G1-025 Protection, Detection and Response [Reference 51].",,S,,R,,,,P1,,(B) frequency [at a frequency no longer than monthly],
PE,6,-1,MONITORING PHYSICAL ACCESS,Operational,"MONITORING PHYSICAL ACCESS | INTRUSION ALARMS / SURVEILLANCE EQUIPMENT
 The organization monitors physical intrusion alarms and surveillance equipment.",,,,,,R,,,,P2,,,
PE,6,-4,MONITORING PHYSICAL ACCESS,Operational,"MONITORING PHYSICAL ACCESS | MONITORING PHYSICAL ACCESS TO INFORMATION SYSTEMS
 The organization monitors physical access to the information system in addition to the physical access monitoring of the facility as [Assignment: organization-defined physical spaces containing one or more components of the information system].","This control enhancement provides additional monitoring for those areas within facilities where there is a concentration of information system components (e.g., server rooms, media storage areas, communications centres). Related controls: PS-2, PS-3.",,,,,R,,,,P1,,,
PE,8,,ACCESS RECORDS,Operational,"(A) The organization maintains visitor access records to the facility where the information system resides for [Assignment: organization-defined time period]; and
 (B) The organization reviews visitor access records [Assignment: organization-defined frequency].","Visitor access records include, for example, names and organizations of persons visiting, visitor signatures, forms of identification, dates of access, entry and departure times, purposes of visits, and names and organizations of persons visited. Visitor access records are not required for publicly accessible areas",,,,,R,,,,P1,,(B) frequency [at least 90 days],
PE,9,,POWER EQUIPMENT AND POWER CABLING,Operational,(A) The organization protects power equipment and power cabling for the information system from damage and destruction.,"Organizations determine the types of protection necessary for power equipment and cabling employed at different locations both internal and external to organizational facilities and environments of operation. This includes, for example, generators and power cabling outside of buildings, internal cabling and uninterruptable power sources within an office or data centre, and power sources for self-contained entities such as vehicles and satellites. Related control: PE-4",,,,S,R,,,,P3,,,
PE,10,,EMERGENCY SHUTOFF,Operational,"(A) The organization provides the capability of shutting off power to the information system or individual system components in emergency situations.
 (B) The organization places emergency shutoff switches or devices in [Assignment: organization-defined location by information system or system component] to facilitate safe and easy access for personnel.
 (C) The organization protects emergency power shutoff capability from unauthorized activation.","This control applies primarily to facilities containing concentrations of information system resources including, for example, data centres, server rooms, and mainframe computer rooms. Related control: PE-15",,,,S,R,,,,P3,,,
PE,11,,EMERGENCY POWER,Operational,(A) The organization provides a short-term uninterruptible power supply to facilitate [Selection (one or more): an orderly shutdown of the information system; transition of the information system to long-term alternate power] in the event of a primary power source loss.,"Related controls: AT-3, CP-2, CP-7",,,,S,R,,,,P3,,,
PE,12,,EMERGENCY LIGHTING,Operational,(A) The organization employs and maintains automatic emergency lighting for the information system that activates in the event of a power outage or disruption and that covers emergency exits and evacuation routes within the facility.,"This control applies primarily to facilities containing concentrations of information system resources including, for example, data centres, server rooms, and mainframe computer rooms. Related controls: CP-2, CP-7",,,,S,R,,,,P2,,,
PE,13,,FIRE PROTECTION,Operational,(A) The organization employs and maintains fire suppression and detection devices/systems for the information system that are supported by an independent energy source.,"This control applies primarily to facilities containing concentrations of information system resources including, for example, data centres, server rooms, and mainframe computer rooms. Fire suppression and detection devices/systems include, for example, sprinkler systems, handheld fire extinguishers, fixed fire hoses, and smoke detectors",,,,S,R,,,,P2,,,
PE,13,-2,FIRE PROTECTION,Operational,"FIRE PROTECTION | SUPPRESSION DEVICES / SYSTEMS
 The organization employs fire suppression devices/systems for the information system that provide automatic notification of any activation to [Assignment: organization-defined personnel or roles] and [Assignment: organization-defined emergency responders].","Organizations can identify specific personnel, roles, and emergency responders in the event that individuals on the notification list must have appropriate access authorizations and/or clearances, for example, to obtain access to facilities where classified operations are taking place or where there are information systems containing classified information.",,,,S,R,,,,P2,,,
PE,13,-3,FIRE PROTECTION,Operational,"FIRE PROTECTION | AUTOMATIC FIRE SUPPRESSION
 The organization employs an automatic fire suppression capability for the information system when the facility is not staffed on a continuous basis.",,,,,S,R,,,,P2,,,
PE,14,,TEMPERATURE AND HUMIDITY CONTROLS,Operational,"(A) The organization maintains temperature and humidity levels within the facility where the information system resides at [Assignment: organization-defined acceptable levels].
 (B) The organization monitors temperature and humidity levels [Assignment: organization-defined frequency].","This control applies primarily to facilities containing concentrations of information system resources, for example, data centres, server rooms, and mainframe computer rooms. Related control: AT-3",,,,,R,,,,P3,,,
PE,14,-2,TEMPERATURE AND HUMIDITY CONTROLS,Operational,"TEMPERATURE AND HUMIDITY CONTROLS | MONITORING WITH ALARMS / NOTIFICATIONS
 The organization employs temperature and humidity monitoring that provides an alarm or notification of changes potentially harmful to personnel or equipment.",,,,,S,R,,,,P3,,,
PE,15,,WATER DAMAGE PROTECTION,Operational,"(A) The organization protects the information system from damage resulting from water leakage by providing master shutoff or isolation valves that are accessible, working properly, and known to key personnel.","This control applies primarily to facilities containing concentrations of information system resources including, for example, data centres, server rooms, and mainframe computer rooms. Isolation valves can be employed in addition to or in lieu of master shutoff valves to shut off water supplies in specific areas of concern, without affecting entire organizations. Related control: AT-3",,,,S,R,,,,P3,,,
PE,16,,DELIVERY AND REMOVAL,Operational,"(A) The organization authorizes, monitors, and controls [Assignment: organization-defined types of information system components] entering and exiting the facility and maintains records of those items.","Effectively enforcing authorizations for entry and exit of information system components may require restricting access to delivery areas and possibly isolating the areas from the information system and media libraries. Related controls: CM-3, MA-2, MA-3, MP-5, SA-12",RCMP G1-024 Control of Access [Reference 50].,,,,R,,,,P1,,,
PE,17,,ALTERNATE WORK SITE,Operational,"(A) The organization employs [Assignment: organization-defined security controls] at alternate work sites.
 (B) The organization assesses as feasible, the effectiveness of security controls at alternate work sites.
 (C) The organization provides a means for employees to communicate with information security personnel in case of security incidents or problems.","Alternate work sites may include, for example, government facilities or private residences of employees. While commonly distinct from alternative processing sites, alternate work sites may provide readily available alternate locations as part of contingency operations. Organizations may define different sets of security controls for specific alternate work sites or types of sites depending on the work-related activities conducted at those sites. Related controls: AC-17, CP-7",TBS Operational Security Standard on Physical Security [Reference 6].,,,,R,,,,P3,,(A) [Authorizer defined controls],
PL,2,-3,SYSTEM SECURITY PLAN,Management,"SYSTEM SECURITY PLAN | PLAN / COORDINATE WITH OTHER ORGANIZATIONAL ENTITIES
 The organization plans and coordinates security-related activities affecting the information system with [Assignment: organization-defined individuals or groups] before conducting such activities in order to reduce the impact on other organizational entities.","Security-related activities include, for example, security assessments, audits, hardware and software maintenance, patch management, and contingency plan testing. Advance planning and coordination includes emergency and non-emergency (i.e., planned or non-urgent unplanned) situations. The process defined by organizations to plan and coordinate security-related activities can be included in security plans for information systems or other documents, as appropriate. Related controls: CP-4, IR-4.",,R,,,,,,,P2,,,
PL,4,-1,RULES OF BEHAVIOUR,Management,"RULES OF BEHAVIOUR | SOCIAL MEDIA AND NETWORKING RESTRICTIONS
 The organization includes in the rules of behaviour, explicit restrictions on the use of social media/networking sites and posting organizational information on public websites.","This control enhancement addresses rules of behaviour related to the use of social media/networking sites: (i) when organizational personnel are using such sites for official duties or in the conduct of official business; (ii) when organizational information is involved in social media/networking transactions; and (iii) when personnel are accessing social media/networking sites from organizational information systems. Organizations also address specific rules that prevent unauthorized entities from obtaining and/or inferring non-public organizational information (e.g., system account information, personally identifiable information) from social media/networking sites.",,R,,,,,S,,P2,,,
PS,1,,PERSONNEL SECURITY POLICY AND PROCEDURES,Operational,"(A) The organization develops, documents, and disseminates to [Assignment: organization-defined personnel or roles]:
 (a) A personnel security policy that addresses purpose, scope, roles, responsibilities, management commitment, coordination among organizational entities, and compliance; and
 (b) Procedures to facilitate the implementation of the personnel security policy and associated personnel security controls.
 (B) The organization reviews and updates the current:
 (a) Personnel security policy [Assignment: organization-defined frequency]; and
 (b) Personnel security procedures [Assignment: organization-defined frequency].","This control addresses the establishment of policy and procedures for the effective implementation of selected security controls and control enhancements in the PS family. The personnel security policy and procedures reflect applicable GC legislation and TBS policies, directives and standards. Security program policies and procedures at the organization level may make system-specific policies and procedures unnecessary. The policy can be included as part of the general information security policy for organizations or conversely, can be represented by multiple policies reflecting the complex nature of certain organizations. The procedures can be established for the security program in general and for particular information systems, if needed. The organizational risk management strategy is a key factor in establishing policy and procedures",TBS Operational Security Standard - Management of Information Technology Security [Reference 7].,S,,,,R,S,,P1,,(A) (B) frequency [at least annually],
PS,2,,POSITION CATEGORIZATION,Operational,"(A) The organization categorizes all positions based on the injury the individuals could cause by malicious acts resulting from the privileges associated with the position.
 (B) The organization selects the appropriate screening level (e.g. Enhanced Reliability Check (ERC), I, II, III) for individuals filling those positions.
 (C) The organization reviews and revises categorizations [Assignment: organization-defined frequency].",,TBS Standard on Security Screening [Reference 9].,S,,,,R,,,P2,,,
PS,3,,PERSONNEL SCREENING,Operational,"(A) The organization screens individuals prior to authorizing access to the information system in accordance with the TBS Standard on Security Screening [Reference 9].
 (B) The organization rescreens individuals according to [Assignment: organization-defined conditions requiring rescreening and, where rescreening is so indicated, the frequency of such rescreening].","Personnel screening and rescreening activities reflect applicable GC legislation and TBS policies, directives and standards, and specific criteria established for the risk designations of assigned positions. Organizations may define different rescreening conditions and frequencies for personnel accessing information systems based on types of information processed, stored, or transmitted by the systems. Related controls: AC-2, IA-4, PE-2, PS-2","PWGSC Industrial Security Manual [Reference 2].
 TBS Standard on Security Screening [Reference 9].",S,,,,R,,,P1,,,"According to the TBS Personnel Security Standard, personnel must be screened to Enhanced Reliability Status (ERC) when the duties or tasks of a position or contract necessitate access to designated information and assets, regardless of the duration of an assignment, appointment or contract. An individual granted enhanced reliability status may access, on a need-to-know basis, designated information and assets."
PS,3,-3,PERSONNEL SCREENING,Operational,"PERSONNEL SCREENING | INFORMATION WITH SPECIAL PROTECTION MEASURES
 The organization ensures that individuals accessing an information system processing, storing, or transmitting information requiring special protection:
 (a) Have valid access authorizations that are demonstrated by assigned official government duties; and
 (b) Satisfy [Assignment: organization-defined additional personnel screening criteria].","Organizational information requiring special protection includes, for example, Protected Information and Sources and Methods Information (SAMI). Personnel security criteria include, for example, position sensitivity background screening requirements.",,,,,,R,,,None defined,,,
PS,4,,PERSONNEL TERMINATION,Operational,"(A) The organization, upon termination of individual employment disables information system access within [Assignment: organization-defined time period].
 (B) The organization, upon termination of individual employment terminates/revokes any authenticators/credentials associated with the individual.
 (C) The organization, upon termination of individual employment conducts exit interviews that include a discussion of [Assignment: organization-defined information security topics].
 (D) The organization, upon termination of individual employment retrieves all security-related organizational information system-related property.
 (E) The organization, upon termination of individual employment retains access to organizational information and information systems formerly controlled by terminated individual.
 (F) The organization, upon termination of individual employment notifies [Assignment: organization-defined personnel or roles] within [Assignment: organization-defined time period].","Information system-related property includes, for example, hardware authentication tokens, system administration technical manuals, keys, identification cards, and building passes. Exit interviews ensure that terminated individuals understand the security constraints imposed by being former employees and that proper accountability is achieved for information system-related property. Security topics of interest at exit interviews can include, for example, reminding terminated individuals of nondisclosure agreements and potential limitations on future employment. Exit interviews may not be possible for some terminated individuals, for example, in cases related to job abandonment, illnesses, and non-availability of supervisors. Exit interviews are important for individuals with security clearances. Timely execution of termination actions is essential for individuals terminated for cause. In certain situations, organizations consider disabling the information system accounts of individuals that are being terminated prior to the individuals being notified. Related controls: AC-2, IA-4, PE-2, PS-5, PS-6",TBS Standard on Security Screening [Reference 9].,,S,,,R,,,P1,,,
